{
  "$schema": "http://json-schema.org/draft-07/schema#",
  "$id": "apex/schemas/CONTEXT_BUDGET.schema.json",
  "title": "APEX CONTEXT_BUDGET.json (v7)",
  "description": "Per-zone token budgets, utilization thresholds, rotation triggers, and per-agent input limits. v7 design target: 50-60% utilization. [שיפור 19]",
  "type": "object",
  "additionalProperties": false,
  "required": [
    "version",
    "design_principle",
    "zones",
    "thresholds",
    "rotation_triggers",
    "per_agent_limits",
    "context_reduction_priority"
  ],
  "properties": {
    "version": { "type": "string", "const": "v7" },
    "design_principle": { "type": "string" },
    "zones": {
      "type": "object",
      "additionalProperties": false,
      "required": ["stable_prefix", "task_context", "working_memory", "generation_reserve"],
      "properties": {
        "stable_prefix": { "$ref": "#/definitions/zone" },
        "task_context": { "$ref": "#/definitions/zone" },
        "working_memory": { "$ref": "#/definitions/zone" },
        "generation_reserve": { "$ref": "#/definitions/zone" }
      }
    },
    "thresholds": {
      "type": "object",
      "additionalProperties": false,
      "required": [
        "target_utilization_pct",
        "proactive_compact_pct",
        "hard_rotate_pct",
        "never_exceed_pct"
      ],
      "properties": {
        "target_utilization_pct": { "type": "number", "minimum": 0, "maximum": 100 },
        "proactive_compact_pct": { "type": "number", "minimum": 0, "maximum": 100 },
        "hard_rotate_pct": { "type": "number", "minimum": 0, "maximum": 100 },
        "never_exceed_pct": { "type": "number", "minimum": 0, "maximum": 100 },
        "notes": { "type": "string" }
      }
    },
    "rotation_triggers": {
      "type": "array",
      "items": {
        "type": "object",
        "additionalProperties": false,
        "required": ["type", "action"],
        "properties": {
          "type": {
            "type": "string",
            "description": "R13-005 (F-305): Trigger type — one of utilization_pct, phase_boundary, task_batch, time_minutes, recovery_density, or pattern (legacy). The enum is documented in framework/hooks/_rotation-decide.sh; unrecognized types are skipped (no crash, log event rotation.trigger.unknown). Backward-compatible: `pattern` remains supported for the legacy `repeated_tool_errors` entry."
          },
          "value": { "type": ["number", "integer"] },
          "action": { "type": "string" },
          "pattern": { "type": "string" },
          "notes": { "type": "string" }
        }
      }
    },
    "per_agent_limits": {
      "type": "object",
      "additionalProperties": {
        "type": "object",
        "additionalProperties": false,
        "required": ["max_input", "target_input"],
        "properties": {
          "max_input": { "type": "integer", "minimum": 0 },
          "target_input": { "type": "integer", "minimum": 0 }
        }
      }
    },
    "context_reduction_priority": {
      "type": "array",
      "items": { "type": "string" }
    },
    "capacity_tokens": {
      "type": "integer",
      "minimum": 100000,
      "maximum": 1000000,
      "description": "Effective context window capacity in tokens. Default 200000."
    },
    "auto_continuity": {
      "type": "object",
      "description": "v7.1 Auto-Continuity Layer thresholds (memory-watchdog, turn-checkpoint, decision-gate-default). Optional — absent on projects predating Auto-Continuity Layer; consumers MUST fall back to documented defaults.",
      "additionalProperties": true,
      "properties": {
        "_doc": { "type": "string" },
        "bun_memory_threshold_mb": {
          "type": "integer",
          "minimum": 256,
          "description": "Hard threshold (MB) for Bun PrivateMemorySize / Commit. Above this, memory-watchdog increments consecutive_over_threshold. Default 2048."
        },
        "bun_memory_warn_pct": {
          "type": "integer",
          "minimum": 1,
          "maximum": 100,
          "description": "Soft threshold as percent of bun_memory_threshold_mb. Below the hard threshold but above this triggers a status banner. Default 70."
        },
        "bun_memory_debounce_samples": {
          "type": "integer",
          "minimum": 1,
          "description": "Number of consecutive samples over threshold required before AUTO_PAUSE_REQUEST.flag is created. Prevents one-off spikes from triggering pause. Default 3."
        },
        "memory_sample_interval_seconds": {
          "type": "integer",
          "minimum": 5,
          "description": "Minimum seconds between memory samples (memory-watchdog rides on PostToolUse but throttles itself). Default 30."
        },
        "turn_checkpoint_interval": {
          "type": "integer",
          "minimum": 1,
          "description": "Frequency (in tool calls) at which turn-checkpoint.sh writes .apex/TURN_CHECKPOINT.json inside a long-running task. Default 5."
        },
        "turn_checkpoint_freshness_minutes": {
          "type": "integer",
          "minimum": 1,
          "description": "Maximum age of TURN_CHECKPOINT.json in minutes for /apex:resume to surface a 'continue from checkpoint' prompt. Default 30."
        },
        "session_auto_resume": {
          "type": "boolean",
          "description": "When true (default), session-auto-resume.sh emits a SESSION_BOOT banner that instructs Claude to invoke /apex:resume on any new session where session.auto_paused == true."
        },
        "decision_gate_default_action_minutes": {
          "type": "integer",
          "minimum": 1,
          "description": "Minutes the decision-gate waits for user input before applying decision_gate_default_action. Default 10."
        },
        "decision_gate_default_action": {
          "type": "string",
          "enum": ["pause", "continue", "resume"],
          "description": "Default action for decision-gate timeout. Default 'pause' — safe, never silently continues a degraded session."
        },
        "max_consecutive_auto_pauses": {
          "type": "integer",
          "minimum": 1,
          "description": "Breaker: after N consecutive auto-pause→auto-resume cycles within auto_pause_cooldown_minutes, halt and require manual intervention. Default 3."
        },
        "auto_pause_cooldown_minutes": {
          "type": "integer",
          "minimum": 1,
          "description": "Window for max_consecutive_auto_pauses tracking. Default 10."
        }
      }
    }
  },
  "definitions": {
    "zone": {
      "type": "object",
      "additionalProperties": false,
      "required": ["budget_tokens", "contents", "policy"],
      "properties": {
        "budget_tokens": { "type": "integer", "minimum": 0 },
        "contents": { "type": "array", "items": { "type": "string" } },
        "policy": { "type": "string" },
        "notes": { "type": "string" },
        "masking_rule": { "type": "string" },
        "masking_window_turns": { "type": "integer", "minimum": 1, "description": "R13-002 (F-302): Number of most-recent turns retained verbatim in the zone; tool-result blocks older than this window are replaced with single-line masking stubs by framework/hooks/observation-mask.sh. Default 3. Applies primarily to working_memory; other zones may set it for future expansion." }
      }
    }
  }
}
