{
  "version": "v7",
  "design_principle": "Target 50-60% utilization. R2: coding quality degrades above 70%.",
  "zones": {
    "stable_prefix": {
      "budget_tokens": 30000,
      "contents": ["CLAUDE.md", "SPEC.md summary", "STATE.json", "PLAN_META.json"],
      "policy": "Always loaded. Never evicted."
    },
    "task_context": {
      "budget_tokens": 50000,
      "contents": ["Current phase plan", "Task instructions", "Relevant source files"],
      "policy": "Loaded per-task. Evicted on task completion."
    },
    "working_memory": {
      "budget_tokens": 60000,
      "contents": ["Tool outputs", "Agent responses", "Intermediate results"],
      "policy": "Observation masking after task. Compact on threshold.",
      "masking_rule": "delete_after_n_turns",
      "masking_window_turns": 3
    },
    "generation_reserve": {
      "budget_tokens": 60000,
      "contents": ["Model output generation space"],
      "policy": "Reserved. Never allocate for input."
    }
  },
  "thresholds": {
    "target_utilization_pct": 55,
    "proactive_compact_pct": 55,
    "hard_rotate_pct": 70,
    "never_exceed_pct": 75
  },
  "rotation_triggers": [
    {"type": "utilization_pct", "value": 70, "action": "hard_rotate"},
    {"type": "utilization_pct", "value": 55, "action": "proactive_compact"},
    {"type": "pattern", "pattern": "repeated_tool_errors", "action": "warn_and_compact"}
  ],
  "per_agent_limits": {
    "planner": {"max_input": 40000, "target_input": 25000},
    "architect": {"max_input": 30000, "target_input": 20000},
    "executor": {"max_input": 30000, "target_input": 20000},
    "critic": {"max_input": 25000, "target_input": 15000},
    "verifier": {"max_input": 20000, "target_input": 12000}
  },
  "context_reduction_priority": [
    "observation_masking",
    "compact_working_memory",
    "evict_completed_task_context",
    "hard_rotate"
  ],
  "capacity_tokens": 200000,
  "auto_continuity": {
    "_doc": "v7.1 Auto-Continuity Layer — autonomous session continuity for unbounded long-running APEX projects. All fields optional with documented defaults.",
    "bun_memory_threshold_mb": 2048,
    "bun_memory_warn_pct": 70,
    "bun_memory_debounce_samples": 3,
    "memory_sample_interval_seconds": 30,
    "turn_checkpoint_interval": 5,
    "turn_checkpoint_freshness_minutes": 30,
    "session_auto_resume": true,
    "decision_gate_default_action_minutes": 10,
    "decision_gate_default_action": "pause",
    "max_consecutive_auto_pauses": 3,
    "auto_pause_cooldown_minutes": 10
  }
}
